<?xml version="1.0" encoding="UTF-8"?>
<xs:schema xmlns:xs="http://www.w3.org/2001/XMLSchema">
    <xs:element name="missionLog">
        <xs:complexType>
            <xs:sequence>
                <xs:element name="date" type="xs:date"/>
                <xs:element name="astronaut" type="xs:string"/>
                <xs:element name="tasks">
                    <xs:complexType>
                        <xs:sequence>
                            <xs:element name="task" maxOccurs="unbounded">
                                <xs:complexType>
                                    <xs:sequence>
                                        <xs:element name="title" type="xs:string"/>
                                        <xs:element name="description" type="xs:string"/>
                                        <xs:element name="timeSpent">
                                            <xs:simpleType>
                                                <xs:restriction base="xs:integer">
                                                    <xs:minInclusive value="1"/>
                                                    <xs:maxInclusive value="300"/>
                                                </xs:restriction>
                                            </xs:simpleType>
                                        </xs:element>
                                    </xs:sequence>
                                    <xs:attribute name="status" use="required">
                                        <xs:simpleType>
                                            <xs:restriction base="xs:string">
                                                <xs:enumeration value="pending"/>
                                                <xs:enumeration value="completed"/>
                                            </xs:restriction>
                                        </xs:simpleType>
                                    </xs:attribute>
                                </xs:complexType>
                            </xs:element>
                        </xs:sequence>
                    </xs:complexType>
                </xs:element>
            </xs:sequence>
            <xs:attribute name="mission" type="xs:string" use="required"/>
        </xs:complexType>
    </xs:element>
</xs:schema>